movie_id,title,description,director_id,rank,year,run_time,vote,rating,revenue,meta_score
b92305f9-e713-4e60-bdee-f5a02bd1e694,"Miss Peregrine's Home for Peculiar Children","When Jacob discovers clues to a mystery that stretches across time, he finds Miss Peregrine's Home for Peculiar Children. But the danger deepens after he gets to know the residents and learns about their special powers.",58ab4ea5-e80d-4316-8d2e-708765418e4c,121,2016,127,101058,6.7,87.24,57
b960de63-73e7-47da-84d4-bb45b1d2b12e,Dark Shadows,"An imprisoned vampire, Barnabas Collins, is set free and returns to his ancestral home, where his dysfunctional descendants are in need of his protection.",58ab4ea5-e80d-4316-8d2e-708765418e4c,726,2012,113,209326,6.2,79.71,55
b968f879-e0bd-46e4-9cfb-6694fee96efa,The Hurt Locker,"During the Iraq War, a Sergeant recently assigned to an army bomb squad is put at odds with his squad mates due to his maverick way of handling his work.",9d99e97b-8373-449d-a887-97af4907c776,673,2008,131,352023,7.6,15.7,94
b97b0875-3f86-4fa9-bce7-e71bd0a0afe5,The Master,A Naval veteran arrives home from war unsettled and uncertain of his future - until he is tantalized by The Cause and its charismatic leader.,c11e5399-a91b-4cf9-a138-c690f3163a6a,930,2012,144,112902,7.1,16.38,
b9a9c9b9-a121-45b9-855f-ff3c13def6ea,Dragonball Evolution,"The young warrior Son Goku sets out on a quest, racing against time and the vengeful King Piccolo, to collect a set of seven magical orbs that will grant their wielder unlimited power.",d28dca2a-bd2d-4ae6-ab4d-4face1d7343e,872,2009,85,59512,2.7,9.35,45
ba215ec0-9e01-4510-862d-6a9078a13b54,"Crazy, Stupid, Love.","A middle-aged husband's life changes dramatically when his wife asks him for a divorce. He seeks to rediscover his manhood with the help of a newfound friend, Jacob, learning to pick up girls at bars.",5d4cea78-446b-4a18-8ffa-080d13fc00a9,158,2011,118,396714,7.4,84.24,68
ba728c50-61c4-4f8d-8b17-63df47f013d0,Trainwreck,"Having thought that monogamy was never possible, a commitment-phobic career woman may have to face her fears when she meets a good guy.",b66b5db1-77db-427a-804f-8e6239ec0570,190,2015,125,106364,6.3,110.01,75
ba7990ab-8b54-4e78-ab43-9da21410277b,Dear White People,The lives of four black students at an Ivy League college.,58dab88a-e982-485e-b76e-6c811c18d1e4,263,2014,108,21715,6.2,4.4,79
ba8f9754-f813-4fea-abbb-51e3963eb222,Idiocracy,"Private Joe Bauers, the definition of ""average American"", is selected by the Pentagon to be the guinea pig for a top-secret hibernation program. Forgotten, he awakes five centuries in the future. He discovers a society so incredibly dumbed down that he's easily the most intelligent person alive.",a6118a60-7d27-462d-a281-1fd38b0a5bb0,560,2006,84,115355,6.6,0.44,66
bacd7f77-ab5a-45be-bb6f-1f6264f2668e,Manchester by the Sea,"A depressed uncle is asked to take care of his teenage nephew after the boy's father dies.",28157974-7c8c-4666-97c1-308783ea83cb,22,2016,137,134213,7.9,47.7,96
bb297d1d-24f2-446b-9be1-d4b9d81f34d4,Spy,"A desk-bound CIA analyst volunteers to go undercover to infiltrate the world of a deadly arms dealer, and prevent diabolical global disaster.",c6b5249e-29ff-4792-a505-38ba983e18cf,249,2015,119,188017,7.1,110.82,75
bbb71f6c-238b-4851-a11d-625764e18118,Rock of Ages,"A small town girl and a city boy meet on the Sunset Strip, while pursuing their Hollywood dreams.",252d79cb-fccc-4071-8cfc-8cf3bc13dfb3,973,2012,123,64513,5.9,38.51,47
bbd209e0-9a7a-4331-98fa-4bc0bc611ca7,Megan Is Missing,Two teenage girls encounter an Internet child predator.,5fe2ecf4-fa1c-4be9-a932-363a90e0009a,634,2011,85,6683,4.9,,94
bc41fe6c-7861-4cf5-b70e-e784aecf0fde,Megamind,"The supervillain Megamind finally defeats his nemesis, the superhero Metro Man. But without a hero, he loses all purpose and must find new meaning to his life.",eed669aa-d1c0-4917-859d-8eaddaf3f4e8,600,2010,95,183926,7.3,148.34,63
bd1aa441-2597-4336-81dc-1ac9930fe2ec,The Twilight Saga: Eclipse,"As a string of mysterious killings grips Seattle, Bella, whose high school graduation is fast approaching, is forced to choose between her love for vampire Edward and her friendship with werewolf Jacob.",4300c868-f1f0-4d22-b172-45c5aae70a14,942,2010,124,192740,4.9,300.52,58
bd329c65-5961-4a1a-ae78-360db04e6631,Rio,"When Blu, a domesticated macaw from small-town Minnesota, meets the fiercely independent Jewel, he takes off on an adventure to Rio de Janeiro with the bird of his dreams.",ace0ceb8-979d-428b-b26e-f3f8c00d1a61,884,2011,96,173919,6.9,143.62,63
bd51e868-3c7c-42d7-a71c-daeb28d4ea1d,Storks,"Storks have moved on from delivering babies to packages. But when an order for a baby appears, the best delivery stork must scramble to fix the error by delivering the baby.",a8722c06-ce1b-4d23-8335-78f2b9e5829b,331,2016,87,34248,6.9,72.66,56
bd569d63-72c5-47ac-beb9-929a5f5e12b0,Handsome Devil,"Ned and Conor are forced to share a bedroom at their boarding school. The loner and the star athlete at this rugby-mad school form an unlikely friendship until it's tested by the authorities.",2de305cd-ceaf-4516-adfc-d3b94dc8885a,606,2016,95,338,7.4,,
bd771063-8a69-4c69-a244-3f0483331be9,Hugo,"In Paris in 1931, an orphan named Hugo Cabret who lives in the walls of a train station is wrapped up in a mystery involving his late father and an automaton.",f42194e8-2ac6-4281-b5ac-06303a9cf51a,736,2011,126,259182,7.5,73.82,83
bd981856-7269-4bd3-9abf-a08c82d23773,The Skin I Live In,"A brilliant plastic surgeon, haunted by past tragedies, creates a type of synthetic skin that withstands any kind of damage. His guinea pig: a mysterious and volatile woman who holds the key to his obsession.",a5b6e2d8-408a-416f-be3f-f38caf23f84f,980,2011,120,108772,7.6,3.19,70
bde6774a-16c0-4cc6-9cf3-b3f7569703ba,Ballerina,"An orphan girl dreams of becoming a ballerina and flees her rural Brittany for Paris, where she passes for someone else and accedes to the position of pupil at the Grand Opera house.",ac1f35ec-e771-43ff-9eee-caf63efadd49,275,2016,89,4729,6.8,,
bee0134e-becf-4f83-b50c-2ed13f51fbc6,Inside Out,"After young Riley is uprooted from her Midwest life and moved to San Francisco, her emotions - Joy, Fear, Anger, Disgust and Sadness - conflict on how best to navigate a new city, house, and school.",00975ecc-67c6-42c3-acb2-0851108d73c1,242,2015,95,416689,8.2,356.45,94
beebe496-aa5b-4360-8f9e-1f44e1c47c3f,The Fall,"In a hospital on the outskirts of 1920s Los Angeles, an injured stuntman begins to tell a fellow patient, a little girl with a broken arm, a fantastic story of five mythical heroes. Thanks to his fractured state of mind and her vivid imagination, the line between fiction and reality blurs as the tale advances.",1590f995-2e9b-4bde-82fc-2d4af1c81fc1,898,2006,117,93036,7.9,2.28,64
bf8748be-1aeb-434e-a69a-c38daeed7128,The Stanford Prison Experiment,Twenty-four male students out of seventy-five were selected to take on randomly assigned roles of prisoners and guards in a mock prison situated in the basement of the Stanford psychology building.,7ceb87cb-2954-47e4-a18e-f0d8fe7cb45d,868,2015,122,20907,6.9,0.64,67
bfbe40ea-0fbb-469e-92c9-c41841e8f1a2,Lovesong,The relationship between two friends deepens during an impromptu road trip.,d27fde84-a348-4ff3-8aac-f78e24ac4f3a,322,2016,84,616,6.4,0.01,74
c02f162b-64f3-4d28-bbc3-dd2968cfb5d6,The Equalizer,"A man believes he has put his mysterious past behind him and has dedicated himself to beginning a new, quiet life. But when he meets a young girl under the control of ultra-violent Russian gangsters, he can't stand idly by - he has to help her.",97710f36-5054-490c-bd43-199e5027c392,301,2014,132,249425,7.2,101.53,57
c0d69573-a22f-4e0e-afb2-e91b3b5f6cfb,Rock Dog,"When a radio falls from the sky into the hands of a wide-eyed Tibetan Mastiff, he leaves home to fulfill his dream of becoming a musician, setting into motion a series of completely unexpected events.",24a66f9b-955b-4e0f-b122-cf528f01b525,243,2016,90,1109,5.8,9.4,48
c10a4625-6bc9-46d6-8f53-48f1ae632d90,Sherlock Holmes: A Game of Shadows,"Sherlock Holmes and his sidekick Dr. Watson join forces to outwit and bring down their fiercest adversary, Professor Moriarty.",5a939011-a0eb-4a14-af77-4d7193d494a3,466,2011,129,357436,7.5,186.83,48
c1115bd3-5082-4f5d-8d70-859b20989f57,The Man Who Knew Infinity,"The story of the life and academic career of the pioneer Indian mathematician, Srinivasa Ramanujan, and his friendship with his mentor, Professor G.H. Hardy.",dfdada43-afa4-4fca-b782-6e45e789f51f,780,2015,108,29912,7.2,3.86,
c1292e3e-e84a-4ef8-90b0-72d08a181cd7,Birth of the Dragon,"Young, up-and-coming martial artist, Bruce Lee, challenges legendary kung fu master Wong Jack Man to a no-holds-barred fight in Northern California.",2312d58e-7a5b-4172-85c0-896b543d49b9,526,2016,103,552,3.9,93.05,61
c12b38c8-58bf-4907-baaa-83113de5f4ab,The Intouchables,"After he becomes a quadriplegic from a paragliding accident, an aristocrat hires a young man from the projects to be his caregiver.",739cc366-fae0-4830-8388-6ce3cb445acc,250,2011,112,557965,8.6,13.18,57
c1471c75-77bb-48bd-9249-0c9c3a9fc72b,"What's Your Number?","A woman looks back at the past nineteen men she's had relationships with in her life and wonders if one of them might be her one true love.",2687fc6d-b804-485d-a12e-5e7f2b3259a0,944,2011,106,62095,6.1,13.99,35
c15adb46-c5bd-443a-a405-6584eb748c45,Mean Dreams,"Follows Casey and Jonas, two teenagers desperate to escape their broken and abusive homes and examines the desperation of life on the run and the beauty of first love.",93026a82-0a87-4cef-89bc-1382c828e0ff,849,2016,108,1066,6.3,,64
c16856c0-dfe3-422b-b405-c4312914d440,Sherlock Holmes,Detective Sherlock Holmes and his stalwart partner Watson engage in a battle of wits and brawn with a nemesis whose plot is a threat to all of England.,5a939011-a0eb-4a14-af77-4d7193d494a3,282,2009,128,501769,7.6,209.02,57
c1e8d004-0c6e-4ab3-bdd4-1ac578c0a72c,Shin Gojira,Japan is plunged into chaos upon the appearance of a giant monster.,c2b60f1f-2b74-48f2-8684-5f1d388058f2,881,2016,120,8365,6.9,1.91,68
c1f968b8-9382-4b98-80fd-e15ca6ffe926,Finding Dory,"The friendly but forgetful blue tang fish, Dory, begins a search for her long-lost parents, and everyone learns a few things about the real meaning of family along the way.",a6b1118d-0814-415e-9803-9606473987d6,120,2016,97,157026,7.4,486.29,77
c207d4ac-563b-4af3-89ab-420b69b02f58,Jack Ryan: Shadow Recruit,"Jack Ryan, as a young covert CIA analyst, uncovers a Russian plot to crash the U.S. economy with a terrorist attack.",2f3b6232-8551-4528-add5-2fcf8268cbfe,804,2014,105,103681,6.2,50.55,57
c20a924c-c174-4e28-8f35-f92a3d4e1ff3,La La Land,A jazz pianist falls for an aspiring actress in Los Angeles.,9d2ba8be-1c5c-4866-8429-b02b12b59034,7,2016,128,258682,8.3,151.06,93
c2175214-92f5-427e-80e8-56cbd32c907c,Tracktown,"A young, talented, and lonely long-distance runner twists her ankle as she prepares for the Olympic Trials and must do something she's never done before: take a day off.",99a50042-5062-42b6-be38-f9c1772d0b52,338,2016,88,115,5.9,,64
c2294ac6-85c0-427f-9d8b-e0262c1c3e61,The Prestige,Two stage magicians engage in competitive one-upmanship in an attempt to create the ultimate stage illusion.,7c906b0d-87d0-492b-96ad-3085489b0c7d,65,2006,130,913152,8.5,53.08,66
c25ad18d-87ee-483c-8a86-d8c82356d25f,The Interview,"Dave Skylark and his producer Aaron Rapoport run the celebrity tabloid show ""Skylark Tonight"". When they land an interview with a surprise fan, North Korean dictator Kim Jong-un, they are recruited by the CIA to turn their trip to Pyongyang into an assassination mission.",28268d57-6b70-4a57-a152-294bd80a5c4f,632,2014,112,261536,6.6,6.11,52
c2cc46b3-57d3-41e3-85c9-1f1713aaf316,Jupiter Ascending,A young woman discovers her destiny as an heiress of intergalactic nobility and must fight to protect the inhabitants of Earth from an ancient and destructive industry.,f28520f2-7de8-4990-8bc4-73e1debd0c08,288,2015,127,150121,5.3,47.38,40
c2f26058-2712-46b5-a220-93dc3c1efab0,The Ghost Writer,A ghostwriter hired to complete the memoirs of a former British prime minister uncovers secrets that put his own life in jeopardy.,9e47e269-57d4-458e-9ac6-f8c6f017cfd5,541,2010,128,137964,7.2,15.52,77
c37443c1-7159-417a-a51b-210e478d1dd3,The Break-Up,"In a bid to keep their luxurious condo from their significant other, a couple's break-up proceeds to get uglier and nastier by the moment.",01c675c7-a9a7-45b9-82ca-52a7eb158a6b,551,2006,106,106381,5.8,118.68,45
c3fa8a48-0b6e-403b-8698-41f98a1a3e2a,"Alexander and the Terrible, Horrible, No Good, Very Bad Day","Alexander's day begins with gum stuck in his hair, followed by more calamities. However, he finds little sympathy from his family and begins to wonder if bad things only happen to him, his mom, dad, brother and sister - who all find themselves living through their own terrible, horrible, no good, very bad day.",988ab203-db19-45c4-955e-bfba841f5faa,863,2014,81,32310,6.2,66.95,54
c41f8b37-a6fb-45f4-8f3a-938e75d2e917,22 Jump Street,"After making their way through high school (twice), big changes are in store for officers Schmidt and Jenko when they go deep undercover at a local college.",89c64c55-78da-4aee-98d5-d67ef3b5aa30,277,2014,112,280110,7.1,191.62,71
c430765d-d23c-4d72-be82-ae586fd9b1ef,Underworld: Rise of the Lycans,"An origins story centered on the centuries-old feud between the race of aristocratic vampires and their onetime slaves, the Lycans.",0de4a976-85ce-4360-910d-e4bfc7cd3bf8,991,2009,92,129708,6.6,45.8,44
c4b2a809-9ede-4e25-a7ea-eb8fdb906167,Entourage,"Movie star Vincent Chase, together with his boys Eric, Turtle, and Johnny, are back - and back in business with super agent-turned-studio head Ari Gold on a risky project that will serve as Vince's directorial debut.",f2842377-7eee-4e2b-acb9-7d3dea6c7393,717,2015,104,64557,6.6,32.36,38
c4f1e4a1-251a-4fc7-9a41-95a1a1970fc6,The Dressmaker,"A glamorous woman returns to her small town in rural Australia. With her sewing machine and haute couture style, she transforms the women and exacts sweet revenge on those who did her wrong.",fd8a78c2-1b61-41e6-a5f2-37012e8ff9aa,353,2015,119,33352,7.1,2.02,47
c6820cb9-aa7d-4d5d-9964-cec3aae32de2,The Lucky One,A Marine travels to Louisiana after serving three tours in Iraq and searches for the unknown woman he believes was his good luck charm during the war.,2008f478-5deb-4ae9-afcb-6f6fcf837dc9,888,2012,101,82874,6.5,60.44,39
c732aa12-be7b-48ae-b5d5-aa3a5373a7d4,Beautiful Creatures,"Ethan longs to escape his small Southern town. He meets a mysterious new girl, Lena. Together, they uncover dark secrets about their respective families, their history and their town.",54f85530-521e-4047-9957-e0bf1b949675,611,2013,124,71822,6.2,19.45,52
c7754d48-32ba-4efc-9f3a-d7293a75c3e5,Legend,Identical twin gangsters Ronald and Reginald Kray terrorize London during the 1960s.,db8ccce3-a109-400c-97a8-9c944bf54b8d,101,2015,132,108836,7,1.87,55
c840e7ba-810e-4e5d-83c5-a6feb3b20ca6,X-Men: The Last Stand,"When a cure is found to treat mutations, lines are drawn amongst the X-Men, led by Professor Charles Xavier, and the Brotherhood, a band of powerful mutants organized under Xavier's former ally, Magneto.",626ebb65-b043-44f8-9bae-bd08874b3e35,627,2006,104,406540,6.7,234.36,58
c88fbacd-d34d-48ea-b71e-da8d0d9d02d3,Teenage Mutant Ninja Turtles,"When a kingpin threatens New York City, a group of mutated turtle warriors must emerge from the shadows to protect their home.",8db9a008-7e57-479a-be94-fabf5ce4c407,658,2014,101,178527,5.9,190.87,31
c9130d45-259b-436e-9143-b36be23984d8,Midnight Special,"A father and son go on the run, pursued by the government and a cult drawn to the child's special powers.",a5e96eb2-9b4c-4886-8384-059cf91ad047,546,2016,112,54787,6.7,3.71,76
c9535cf5-68b9-42f7-870d-a0102ae167e2,Horrible Bosses,Three friends conspire to murder their awful bosses when they realize they are standing in the way of their happiness.,7547177a-6548-4d50-80ac-9347c641a397,608,2011,98,368556,6.9,117.53,57
c97b2bff-2ddc-47ba-b86c-a7094ddebe81,The Assignment,"After waking up and discovering that he has undergone gender reassignment surgery, an assassin seeks to find the doctor responsible.",feaf81ce-a344-4212-a07c-27864f469b3c,772,2016,95,2043,4.5,,34
c9b16223-a5dd-4d0e-bc07-55d0c5810b47,The Lost City of Z,"A true-life drama, centering on British explorer Col. Percival Fawcett, who disappeared while searching for a mysterious city in the Amazon in the 1920s.",08447a92-9b99-4d6e-a3da-92f333383e4b,9,2016,141,7188,7.1,8.01,78
c9b73c30-ba52-4345-ae13-18369d7eda0b,Elysium,"In the year 2154, the very wealthy live on a man-made space station while the rest of the population resides on a ruined Earth. A man takes on a mission that could bring equality to the polarized worlds.",07c25b37-b25e-4352-bd9d-690e380df1ad,527,2013,109,358932,6.6,,
c9cb9e27-6857-4e5e-b886-c1109a30884b,Blood Diamond,"A fisherman, a smuggler, and a syndicate of businessmen match wits over the possession of a priceless diamond.",74276462-fa2a-437f-80ac-a7f02870e319,670,2006,143,422014,8,57.37,64
ca169324-ef2b-49ae-83d3-02036744cb55,Nightcrawler,"When Louis Bloom, a con man desperate for work, muscles into the world of L.A. crime journalism, he blurs the line between observer and participant to become the star of his own story.",e1a12b7b-d4f8-4989-84ea-3cb7f1c4cee5,171,2014,118,332476,7.9,32.28,76
ca364c16-ec12-48be-a7da-73592a7512de,Gone Girl,"With his wife's disappearance having become the focus of an intense media circus, a man sees the spotlight turned on him when it's suspected that he may not be innocent.",4721aabe-d5ad-462a-949a-fb2d5f5aa400,84,2014,149,636243,8.1,167.74,79
ca77caa1-f3a8-44c3-960a-1574afebb16f,"2307: Winter's Dream","In 2307, a future soldier is sent on a mission to hunt down the leader of the humanoid rebellion.",7586361c-2258-4998-a6f6-09a935e4e9c8,617,2016,101,277,4,20.76,53
ca9d278c-31be-4de2-a735-06b97f258c38,28 Weeks Later,"Six months after the rage virus was inflicted on the population of Great Britain, the US Army helps to secure a small area of London for the survivors to repopulate and start again. But not everything goes to plan.",76a7b46c-67ff-4f35-8d38-6ea56e0b27d3,876,2007,100,221858,7,28.64,78
cb02284b-5302-4eb0-9e8b-11c8ca786356,Mommy,"A widowed single mother, raising her violent son alone, finds new hope when a mysterious neighbor inserts herself into their household.",905a1b38-da66-430c-833e-a1eee6198faf,609,2014,139,33560,8.1,3.49,74
cb09d246-4c7d-4f02-8e2e-31f6125f3332,Zero Dark Thirty,"A chronicle of the decade-long hunt for al-Qaeda terrorist leader Osama bin Laden after the September 2001 attacks, and his death at the hands of the Navy S.E.A.L.s Team 6 in May 2011.",9d99e97b-8373-449d-a887-97af4907c776,407,2012,157,226661,7.4,95.72,95
cb5dc86e-7312-4aaf-bead-5fd66f18f41d,Hell or High Water,"A divorced father and his ex-con older brother resort to a desperate scheme in order to save their family's ranch in West Texas.",8eb93876-8d4d-488a-b8d9-5a0f57cae1c8,106,2016,102,115546,7.7,26.86,88
cba72870-f5d6-4098-8505-5ea6a30cdf89,True Crimes,"A murder investigation of a slain business man turns to clues found in an author's book about an eerily similar crime. Based on the 2008 article ""True Crimes - A postmodern murder mystery"" by David Grann.",90b2d2a1-fc5e-4711-887a-9a50b8b6501f,539,2016,92,198,7.3,,43
cc4bd4e7-d444-487e-8f1f-e0f8f5e9b922,Whisky Galore,Scottish islanders try to plunder cases of whisky from a stranded ship.,e7b79b1c-6ee4-422d-b0de-5ff35a2e10fc,394,2016,98,102,5,,43
ccc724a8-8e59-41b2-b07a-fe42a64c98f9,Miracles from Heaven,A young girl suffering from a rare digestive disorder finds herself miraculously cured after surviving a terrible accident.,baca02d1-99a9-493c-ab55-81793b28aa13,981,2016,109,12048,7,61.69,44
ccc9ec3e-a3e2-4f4c-887c-66a82be04050,Her,A lonely writer develops an unlikely relationship with an operating system designed to meet his every need.,0cd3353a-14b8-4966-8e60-f6e065e1d278,174,2013,126,390531,8,25.56,90
cce3c33a-5148-4274-b26b-cf6834be38c7,Oz the Great and Powerful,"A frustrated circus magician from Kansas is transported to a magical land called Oz, where he will have to fulfill a prophecy to become the king, and release the land from the Wicked Witches using his great (but fake) powers.",aeec2d45-d242-4f76-b9b4-9e2d43ad2d48,441,2013,130,181521,6.3,234.9,44
ccf62059-6054-4012-a29f-baac524c06ac,A Dark Song,A determined young woman and a damaged occultist risk their lives and souls to perform a dangerous ritual that will grant them what they want.,08470b45-1ffb-4a85-8d6c-e74149ae08b9,219,2016,100,1703,6.1,,67
ccf9fdcc-d9af-4cbb-821b-aaf5a48f8a90,Cars 2,Star race car Lightning McQueen and his pal Mater head overseas to compete in the World Grand Prix race. But the road to the championship becomes rocky as Mater gets caught up in an intriguing adventure of his own: international espionage.,7af1b8a1-9c8e-4336-a804-9c0a74fe14bd,776,2011,106,110490,6.2,191.45,57
cd21744c-611c-4383-be0c-8b3d25daeb46,Precious,"In New York City's Harlem circa 1987, an overweight, abused, illiterate teen who is pregnant with her second child is invited to enroll in an alternative school in hopes that her life can head in a new direction.",afb46684-91d2-4ab6-87ae-7aa08f03ea37,927,2009,110,91623,7.3,47.54,79
cd6e793f-11cf-41ed-9cd6-069802da1b9c,Hellboy II: The Golden Army,"The mythical world starts a rebellion against humanity in order to rule the Earth, so Hellboy and his team must save the world from the rebellious creatures.",e78ad0ce-3e2d-4de4-8f4e-f3d1c4a855a7,610,2008,120,216932,7,75.75,78
ce13dba4-dee5-4c30-8cb0-527ab359e569,The Devil Wears Prada,"A smart but sensible new graduate lands a job as an assistant to Miranda Priestly, the demanding editor-in-chief of a high fashion magazine.",56b90fa5-7dc3-4051-b08d-e474424fbbe2,298,2006,109,302268,6.8,124.73,62
ced36235-0b32-4ff2-8786-725c0fe624ba,Koe no katachi,"The story revolves around Nishimiya Shoko, a grade school student who has impaired hearing. She transfers into a new school, where she is bullied by her classmates, especially Ishida Shouya... See full summary »",9c687f77-e1cb-4a19-b4df-76c98bec6c81,862,2016,129,2421,8.4,,80
cef31d00-4ba5-4609-84ea-6b4d285177f9,Annabelle,A couple begins to experience terrifying supernatural occurrences involving a vintage doll shortly after their home is invaded by satanic cultists.,a5e00c17-479b-4c59-88e9-9b7fdae6aa02,819,2014,99,91106,5.4,84.26,37
cef83824-19f6-4e74-95d4-0f194989b4ed,Shut In,"A heart-pounding thriller about a widowed child psychologist who lives in an isolated existence in rural New England. Caught in a deadly winter storm, she must find a way to rescue a young boy before he disappears forever.",a1adac30-d779-4d64-a037-9b7333d1af6e,827,2016,91,5715,4.6,6.88,
cf0c0050-de54-40c3-9c57-147ff3707e35,Spotlight,"The true story of how the Boston Globe uncovered the massive scandal of child molestation and cover-up within the local Catholic Archdiocese, shaking the entire Catholic Church to its core.",87877021-614b-4d61-9bc4-12fd7e78a4b5,193,2015,128,268282,8.1,44.99,93
cf6c0476-1779-410a-beee-c051b72bdb8b,The Maze Runner,"Thomas is deposited in a community of boys after his memory is erased, soon learning they're all trapped in a maze that will require him to join forces with fellow ""runners"" for a shot at escape.",571d57df-1847-4699-82d8-231c2463ecca,372,2014,113,335531,6.8,102.41,57
cf6dc6cc-cd37-42fc-88ec-6b2ea334e51a,The Proposal,A pushy boss forces her young assistant to marry her in order to keep her visa status in the U.S. and avoid deportation to Canada.,852c9124-230e-444f-872b-ba00af8a42f4,457,2009,108,241709,6.7,163.95,48
cfa63310-b47f-443c-a391-f2d6aaf030ad,Macbeth,"Macbeth, the Thane of Glamis, receives a prophecy from a trio of witches that one day he will become King of Scotland. Consumed by ambition and spurred to action by his wife, Macbeth murders his king and takes the throne for himself.",be1c6492-a40e-41cc-ba96-b582425b6877,480,2015,113,41642,6.7,,71
cff26767-399a-446f-bcd9-f31ae1ee27d5,Texas Chainsaw 3D,A young woman travels to Texas to collect an inheritance; little does she know that an encounter with a chainsaw-wielding killer is part of the reward.,cc5f4bf8-9505-4cdb-9410-a981bba2a389,971,2013,92,37060,4.8,34.33,62
d001737e-ef1e-4278-937f-40722c98eb15,Hardcore Henry,"Henry is resurrected from death with no memory, and he must save his wife from a telekinetic warlord with a plan to bio-engineer soldiers.",899fb321-bc0e-403b-ab9d-fadc00f3390b,221,2015,96,61098,6.7,9.24,51
d03d692d-c6bd-4e6f-94bb-f32a10d81522,John Wick,An ex-hitman comes out of retirement to track down the gangsters that took everything from him.,2d60a16a-3b9f-4870-9570-3a7602f4772a,54,2014,101,321933,7.2,43,68
d03e5bfe-6860-441e-a066-6d478a35a00a,No Strings Attached,"A guy and girl try to keep their relationship strictly physical, but it's not long before they learn that they want something more.",77ddb737-e8ab-42c1-aae3-ebe8f8aaa682,796,2011,108,178243,6.2,70.63,50
d052f589-ce0e-4649-aa94-b61f5fb2270f,The Bad Batch,A dystopian love story in a Texas wasteland and set in a community of cannibals.,9d4e97b8-baa2-4f0f-8542-08dea9946df1,113,2016,118,512,6.1,,65
d0c8b2b8-1d02-4b26-9f56-83c44e024272,Monster Trucks,A young man working at a small town junkyard discovers and befriends a creature which feeds on oil being sought by a fracking company.,43004a9d-fa56-4446-95bd-888fec4d611f,218,2016,104,7044,5.7,33.04,41
d0cee066-fe78-437f-be58-cefc2161c572,Superman Returns,"Superman reappears after a long absence, but is challenged by an old foe who uses Kryptonian technology for world domination.",526e77f5-711b-459e-91f2-2172d82ca9ff,925,2006,154,246797,6.1,200.07,72
